{"$id":"https://surfaces.dev/schemas/designer-workflow-trace/designer-workflow-trace-preflight-mutation.v0.schema.json","$schema":"https://json-schema.org/draft/2020-12/schema","additionalProperties":false,"properties":{"boundaryRefs":{"items":{"additionalProperties":false,"properties":{"hash":{"pattern":"^[0-9a-f]{64}$","type":["string","null"]},"hashAlgorithm":{"const":"sha256"},"path":{"type":"string"},"schemaId":{"type":"string"},"sourceEvidenceHash":{"pattern":"^[0-9a-f]{64}$","type":"string"},"sourceRef":{"type":["string","null"]}},"required":["path","schemaId","hashAlgorithm","hash","sourceRef"],"type":"object"},"type":"array"},"command":{"const":"interfacectl surfaces designer-workflow-trace proof"},"mutation":{"type":"string"},"provenance":{"additionalProperties":false,"properties":{"generatedAt":{"const":"1970-01-01T00:00:00.000Z"},"generator":{"type":"string"},"sourceRefs":{"items":{"type":"string"},"type":"array"}},"required":["generatedAt","generator","sourceRefs"],"type":"object"},"schemaId":{"const":"designer-workflow-trace-preflight-mutation.v0"},"status":{"const":"invalid"},"version":{"type":"string"}},"required":["schemaId","version","command","mutation","status","boundaryRefs","provenance"],"type":"object"}