{"boundaryRefs":[{"hash":"0000000000000000000000000000000000000000000000000000000000000000","hashAlgorithm":"sha256","path":"artifacts/p2/evidence.json","schemaId":"design-system-ingestion-evidence.v0","sourceRef":null},{"hash":"2ba1d418bc51051bb642a0c675efbc7e16f4f315dae62674a6b6e363461c9d29","hashAlgorithm":"sha256","path":"artifacts/p2/governed-catalog.json","schemaId":"runtime-catalog.v0","sourceEvidenceHash":"d469eb7027a724c87e237b6b0e92d7526bb9a9dfee58dd47e4830bf64352a0f4","sourceRef":null},{"hash":"5db246399a04eae4ea557bd3fdaec0fd278194970feeecbd751dc0b677f64a5b","hashAlgorithm":"sha256","path":"artifacts/p2/ingestion-report.json","schemaId":"design-system-ingestion-report.v0","sourceEvidenceHash":"d469eb7027a724c87e237b6b0e92d7526bb9a9dfee58dd47e4830bf64352a0f4","sourceRef":null},{"hash":"fe54450ebd9ac9564f5dcebb96e3b2b58a3c4b7f34d5c52b781cd2ec7baab7cf","hashAlgorithm":"sha256","path":"artifacts/source-conformance/evidence.json","schemaId":"source-conformance-evidence.v0","sourceRef":null},{"hash":"67eab0a13d6e32f1449506c5a7a9664837ed740d6808d48160bfff57ad165c67","hashAlgorithm":"sha256","path":"artifacts/source-conformance/source-authority-map.json","schemaId":"source-authority-map.v0","sourceEvidenceHash":"fe54450ebd9ac9564f5dcebb96e3b2b58a3c4b7f34d5c52b781cd2ec7baab7cf","sourceRef":null},{"hash":"605e5ba9120b90cb449827305c0f95d48a1c62fc87109857083b3c976aac6416","hashAlgorithm":"sha256","path":"artifacts/source-conformance/source-conformance-report.json","schemaId":"source-conformance-report.v0","sourceEvidenceHash":"fe54450ebd9ac9564f5dcebb96e3b2b58a3c4b7f34d5c52b781cd2ec7baab7cf","sourceRef":null},{"hash":"58c62f212706b7805cd3f5a3618e408449dc8b64c85c6455d1c11f40266c1b4f","hashAlgorithm":"sha256","path":"artifacts/source-conformance/source-review-queue.json","schemaId":"source-review-queue.v0","sourceEvidenceHash":"fe54450ebd9ac9564f5dcebb96e3b2b58a3c4b7f34d5c52b781cd2ec7baab7cf","sourceRef":null},{"hash":"08c4c9e62c8643e7427b60f1ad8e48c86cfa5fced0ad1e0d3b6c3e0e5025589c","hashAlgorithm":"sha256","path":"artifacts/p3/evidence.json","schemaId":"agent-orchestration-evidence.v0","sourceRef":null},{"hash":"aac26d2171acaaabbe27c6262d45575eac8bf08c6e6a5284c1340cec184694da","hashAlgorithm":"sha256","path":"artifacts/p3/review-queue.json","schemaId":"agent-review-queue.v0","sourceEvidenceHash":"08c4c9e62c8643e7427b60f1ad8e48c86cfa5fced0ad1e0d3b6c3e0e5025589c","sourceRef":null},{"hash":"a9de1573bc5c4dcd9e0d509d8b60885470a4d6cb2bfcbc0eff5ed451997d71f3","hashAlgorithm":"sha256","path":"artifacts/p4/evidence.json","schemaId":"review-judgment-evidence.v0","sourceRef":null},{"hash":"91dd2b08dc7c99f2ff28c6dca2862379269f0f89c7feb63a073bd51fc5f1ebb8","hashAlgorithm":"sha256","path":"artifacts/p4/surfaceops-decision-ledger.json","schemaId":"surfaceops-decision-ledger.v0","sourceEvidenceHash":"a9de1573bc5c4dcd9e0d509d8b60885470a4d6cb2bfcbc0eff5ed451997d71f3","sourceRef":null},{"hash":"f792803e20a7bca5e235ab332b8b264e3a284bd4d93ba1abc1227582de889243","hashAlgorithm":"sha256","path":"artifacts/p4/judgmentkit-evaluation-report.json","schemaId":"judgmentkit-evaluation-report.v0","sourceEvidenceHash":"a9de1573bc5c4dcd9e0d509d8b60885470a4d6cb2bfcbc0eff5ed451997d71f3","sourceRef":null},{"hash":"ca31dcd66c7037e0b8eff4e24ad5a41ae99497d7a44bc7a558f85bd981f32add","hashAlgorithm":"sha256","path":"artifacts/p4/review-judgment-report.json","schemaId":"review-judgment-report.v0","sourceEvidenceHash":"a9de1573bc5c4dcd9e0d509d8b60885470a4d6cb2bfcbc0eff5ed451997d71f3","sourceRef":null},{"hash":"5c374dda129f223539514f361f827072e0f5c1d73c7cab4572e7f19d74a0665a","hashAlgorithm":"sha256","path":"artifacts/p5/protocol/evidence.json","schemaId":"protocol-adapter-evidence.v0","sourceRef":null},{"hash":"8fe59fce2ab75f056a6a640656f91ddfdd30ad112b167b55dc9a9f56f6ceef75","hashAlgorithm":"sha256","path":"artifacts/p5/native/evidence.json","schemaId":"surfaces-native-evidence.v0","sourceRef":null}],"command":"interfacectl surfaces designer-workflow-trace proof","mutation":"upstream-hash-mismatch","provenance":{"generatedAt":"1970-01-01T00:00:00.000Z","generator":"interfacectl-designer-workflow-trace-materialize","sourceRefs":["fixture://designer-workflow-trace/mutations/upstream-hash-mismatch"]},"schemaId":"designer-workflow-trace-preflight-mutation.v0","status":"invalid","version":"0.0.0"}